{
  "version": 2,
  "selection_rule": "cheapest-reliable-model-that-passes-gates",
  "cross_provider_review": true,
  "context_aware_routing": true,
  "roster": [
    {
      "id": "claude-3-7-sonnet",
      "provider": "anthropic",
      "enabled": true
    }
  ],
  "roles": {
    "architect": {
      "preferred": [
        "claude-3-7-sonnet"
      ],
      "fallback": []
    },
    "debugger": {
      "preferred": [
        "claude-3-7-sonnet"
      ],
      "fallback": []
    },
    "documentation-maintainer": {
      "preferred": [
        "claude-3-7-sonnet"
      ],
      "fallback": []
    },
    "implementer": {
      "preferred": [
        "claude-3-7-sonnet"
      ],
      "fallback": []
    },
    "release-verifier": {
      "preferred": [
        "claude-3-7-sonnet"
      ],
      "fallback": []
    },
    "reviewer": {
      "preferred": [
        "claude-3-7-sonnet"
      ],
      "fallback": []
    },
    "security-reviewer": {
      "preferred": [
        "claude-3-7-sonnet"
      ],
      "fallback": []
    },
    "tester": {
      "preferred": [
        "claude-3-7-sonnet"
      ],
      "fallback": []
    },
    "ux-reviewer": {
      "preferred": [
        "claude-3-7-sonnet"
      ],
      "fallback": []
    }
  },
  "profiles": {}
}
